@context,@type,url,sameAs,contactPoint,alternateName,name,itemListElement,address,image,description,telephone,contactPoint_@type,contactPoint_contactType,contactPoint_email,contactPoint_url,itemListElement_item_name,itemListElement_position,itemListElement_@type,itemListElement_item_@id,address_addressLocality,address_streetAddress,address_addressRegion,address_postalCode,address_@type
https://schema.org,LocalBusiness,,,,,Compassion Community Outreach Food Pantry,,,https://www.foodpantries.org/gallery/32787_compassion-community-outreach-food-pantry_wvt.png,"CCO Food Pantry Hours: 1st and 3rd Sunday of the month 1:00pm to 2:00pm 3rd Wednesday of the month 6:00pm to 7:00pm Emergencies on a case-by-case basis. Case Management Services Available. Annual Backpack Outreach in August Holiday Food Box program in November. For more information, please call.  ",(951) 805-8309,,,,,,,,,Murrieta,25823 Jefferson Ave,CA,92562,PostalAddress
https://schema.org,LocalBusiness,,,,,Murrieta United Methodist Church Food Pantry,,,https://www.foodpantries.org/gallery/38825_ca_92562_murrieta-united-methodist-church-food-pantry_car.png,"With the economy struggling, our Food Pantry meets the needs of area families on a weekly basis. Hours:Friday 8:30amThe pantry supplies free canned and packaged food along with some vegetables, breads, meats, and dairy products.  Our food pantry is blessed generously by our church's budget, but also by other area churches, schools, and service organizations who help contribute money and food.  The pantry serves between 150 and 200 families a week. In addition, there is a weekly Bible Study (in Fellowship Hall)",(951) 677-6174,,,,,,,,,Murrieta ,24652 Adams Ave,CA,92562,PostalAddress
https://schema.org,LocalBusiness,,,,,The Bridge Church Community Care Program,,,https://www.foodpantries.org/gallery/39304_ca_92563_the-bridge-church-community-care-program_xci.png,"The Community Care Program of The Bridge distributes free food and clothing to anyone in need. Hours:Sunday10:45am (excluding the 5th Sunday of the month.) If you or anyone you know, needs a little extra assistance in these areas, we are here to help! Requirements: All we ask for is a valid ID. The Community Care entrance is located in the back of the church building.For more information, please call. ",(951) 600-9112,,,,,,,,,Murrieta,38801 Calistoga Drive,CA,92563,PostalAddress
https://schema.org,LocalBusiness,,,,,Napa Storehouse Food Pantry,,,https://www.foodpantries.org/gallery/24296_the_living_vide_church_94558_vsz.jpg,"Provides a food pantry.  Serves Napa County Pantry Hours: Tuesday's: 9:00am to 12:00pmWednesday's: 9:00am to 12:00pmThursday's 11:00am to 2:00pm(To ensure being served arrive 15 mins before start time)In order to receive food, 1 person per household every 30 days must provide 2 forms of ID,  one with current address and  one with birth date.You must also fill out an application upon each visit.",(707) 253-6128,,,,,,,,,Napa,1746 Yajome St,CA,94559,PostalAddress
https://schema.org,LocalBusiness,,,,,Living Vine Nazarene Church Food Pantry - Living Vine Nazare,,,https://www.foodpantries.org/gallery/24135_living_vine_nazarene_church_food_pantry_living_vine_nazare_94558_vqx.jpg,Provides a food pantry.  Serves Napa County (American Canyon) Pantry Hours: Tuesday 11:00am - 1:30pm,(707) 226-5551,,,,,,,,,Napa,3305 Linda Vista Avenue,CA,94558,PostalAddress
https://schema.org,LocalBusiness,,,,,American Canyon Recreation Center Food Pantry,,,https://www.foodpantries.org/gallery/no_photo_9.jpg,Provides a food pantry.  Serves Napa County (American Canyon) Pantry hours: Second and Fourth Tuesday of the month from 10:30am to 1:30pm. ...,(707) 253-6128,,,,,,,,,American Canyon,2185 Elliott Drive,CA,94503,PostalAddress
https://schema.org,LocalBusiness,,,,,Christian Help Center,,,https://www.foodpantries.org/gallery/no_photo_1.jpg,Provides a food pantry.  Serves Solano County. Documentation Required: Photo ID Pantry Hours: Saturday 10:30am...,(707) 553-8192,,,,,,,,,Vallejo,2166 Sacramento Street,CA,94590,PostalAddress
https://schema.org,LocalBusiness,,,,,Vallejo Nazarene Church,,,https://www.foodpantries.org/gallery/no_photo_2.jpg,"Bag of Groceries Hours: Monday 6:30pm&nbsp; Wednesday 1:00pm Arrive 90 min early. First come, first served.We offer hope giving services and resources so that people can experience independence, wholeness and transformation.Our Mission is to serve in Amador Street community and surrounding communities. We do not discriminate because of race or color, national origin, marital status, gender, economic status, disability, veteran status, religion or belief.Food Bank HoursMonday 5:30...",(707) 648-1986,,,,,,,,,Vallejo,929 Amador Street,CA,94590,PostalAddress
https://schema.org,LocalBusiness,,,,,Good Samaritan Baptist Church,,,https://www.foodpantries.org/gallery/no_photo_6.jpg,"Provides a food pantry.  Serves Solano County (Vallejo). Documentation Required: Photo identification, income verification and proof of residency Pantry Hours: Monday and Thursday 10:00am - 12:00pm 3rd Saturday of every month 9:00am - 11:30am...",(707) 553-1896,,,,,,,,,Vallejo,407 Capitol Street,CA,94590,PostalAddress
https://schema.org,LocalBusiness,,,,,Salvation Army of Vallejo,,,https://www.foodpantries.org/gallery/no_photo_4.jpg,"Provides a food pantry.  Serves Solano County (Vallejo). Documentation Required: Picture identification, proof of residency and income and Social Security Cards for each member of the household. Pantry Hours: Monday 9:00am - 11:30am Tuesday 9:00am - 11:30am and 1:30pm - 4:00pm Wednesday 9:00am - 11:00am and 1:30pm - 4:00pmFor more information, please call. ...",(707) 643-8621,,,,,,,,,Vallejo,630 Tuolumne Street,CA,94590,PostalAddress
https://schema.org,LocalBusiness,,,,,League of Volunteers Emergency Food Bank,,,https://www.foodpantries.org/gallery/33313_league-of-volunteers_ygc.png,"Emergency food bank.Serves: Fremont, Newark, Union City Residents.LOV provides year-round dry and canned food and bread supplies for those who need a little help to get by.Hours:Monday - Friday 8:00pm - 5:00pmFor an appointment or more information, please call. ",(510) 793-5683,,,,,,,,,Newark,"8440 Central Ave., ",CA,94560,PostalAddress
https://schema.org,LocalBusiness,,,,,Tri-City Volunteers,,,https://www.foodpantries.org/gallery/no_photo_10.jpg,"Residents of Fremont, Newark, and Union City are eligible to receive food from us. We are currently primarily serving clients from households whose income falls below 50% of the median income in Alameda County, based on the number of people in the household. Click here&nbsp; to see these limits. In addition, if you are homeless, you may come in once per day to receive a prepared brown bag lunch from us.However, we will not turn away anyone who comes to us in need. We request only that you do not utilize our services unnecessarily, as...",(510) 793-4583,,,,,,,,,Fremont,37350 Joseph Street,CA,94536,PostalAddress
https://schema.org,LocalBusiness,,,,,South Hayward Parish,,,https://www.foodpantries.org/gallery/no_photo_2.jpg,"Our food pantry or food bank provides emergency food for individuals and families. Short term food supplies available for individuals/families in need of assistance.Hours:Tuesday - Friday  8:30am - 5:30pmFor more information, please call. ...",(510) 785-3663,,,,,,,,,Hayward,27287 Patrick Ave.,CA,94544,PostalAddress
https://schema.org,LocalBusiness,,,,,Community of Grace - Hayward,,,https://www.foodpantries.org/gallery/no_photo_6.jpg,"Offer food pantry Hours:Wednesday11:00am - 12:00pmRecovery programs for sexual addiction, co-dependency, and more. Requirements:Picture ID.Must live in Hayward, San Lorenzo, or Castro ValleyAlso serves Castro Valley and San Lorenzo. For more information, please call....",(510) 783-8062,,,,,,,,,Hayward,380 Elmhurst Street,CA,94544,PostalAddress
https://schema.org,LocalBusiness,,,,,LifeMoves,,,https://www.foodpantries.org/gallery/no_photo_5.jpg,"Provides a food pantry.Hours:Monday - Friday8:00am - 4:00pmFor more information, please call. ...",(650) 853-8672,,,,,,,,,Palo Alto,33 Encina Avenue,CA,94301,PostalAddress
https://schema.org,LocalBusiness,,,,,Community Services Agency Community - Food Nutrition Center,,,https://www.foodpantries.org/gallery/no_photo_1.jpg,"Hours:Monday11:30am - 1:30pmTuesday2:00pm - 4:00pmWednesday2:00pm - 4:00pmThursday11:30am - 1:30pmFriday1:30am - 3:30pmFor more information, please call. ...",(650) 968-0836,,,,,,,,,Mountain View,204 Stierlin Rd.,CA,94043,PostalAddress
https://schema.org,LocalBusiness,,,,,The Bridge,,,https://www.foodpantries.org/gallery/24055_ev_free_church_91320_jma.webp,"Provides a food pantry.  Pantry Hours: WednesdayFor more information, please call. ",(805) 262-5000,,,,,,,,,Newbury Park,999 Rancho Canejo Blvd,CA,91320,PostalAddress
https://schema.org,LocalBusiness,,,,,Santa Clarita Valley Food Pantry,,,https://www.foodpantries.org/gallery/3817_santa-clarita-valley-food-pantry_nhi.png,"Provides food pantry and mobile services.Hours:Monday through Thursday9:00am - 12:00pm The third Friday of the month (reserved for senior citizens)9:00am to 12:00pmThe first Saturday of the month (reserved for working clients)10:00am to 12:00pm Requirements: Must be a resident of the Santa Clarita Valley, with income no greater than 150% of the poverty level as defined in the Emergency Food Assistance Program, and be actively seeking employment unless disabled or retired. Requires ID and d",(661) 255-5001,,,,,,,,,Newhall,24133 Railroad Avenue,CA,91321,PostalAddress
https://schema.org,LocalBusiness,,,,,San Geronimo Valley Community Center,,,https://www.foodpantries.org/gallery/24206_san_geronimo_valley_community_center_94946_rxl.jpg,"Provides a food pantry.  Serves Marin County (primarily Forest Knolls, Lagunitas, San Geronimo, Woodacre) Pantry Hours: Monday 9:00am - 5:00pm Thursday2:00pm - 5:00pmFor more information, please call.",(415) 488-8888,,,,,,,,,Nicasio,6350 Sir Francis Drake Boulevard,CA,94963,PostalAddress
https://schema.org,LocalBusiness,,,,,Valley Food Bank,,,https://www.foodpantries.org/gallery/626_valley-food-bank_gyo.png,"The Valley Food Bank was established in 2001 to serve the food insecure in the San Fernando Valley. Our warehouse facility is a central hub that collects, processes, and distributes surplus food at no-charge to a network of rescue centers, food pantries, and soup kitchens to provide hot nutritious meals and food baskets to the homeless and needy throughout the community.For more information, please call.",818 510-4140,,,,,,,,,North Hollywood,12701 Van Nuys Blvd. Suite A,CA,91331,PostalAddress
https://schema.org,LocalBusiness,,,,,Las Buenas Nuevas Church,,,https://www.foodpantries.org/gallery/38831_ca_90650_las-buenas-nuevas-church_gir.jpg,"We distribute food.Hours:The last Saturday of month 9:00am to 12:00pmFood distribution is one box per family, if picking up for someone else you must first have that person fill out a form authorizing you  to do so.Requirements:Must bring a copy of ID of person authorizing you.For more information, please call. ",(562) 926-3147,,,,,,,,,Norwalk,11910 Alondra Blvd.,CA,90650,PostalAddress
https://schema.org,LocalBusiness,,,,,Norwalk Social Services Food Pantry,,,https://www.foodpantries.org/gallery/37822_norwalk_soci-Norwal-90650_hzx.png,"The Norwalk Social Services Center offers a wide range of emergency and support services to residents in crisis situations. Our goal is to assist individuals and families, whose resources have been exhausted, stabilize their situation and seek long-term solutions. Offer Emergency Food Pantry. Adults 60 years and older are welcome to enjoy hot nutritious meals.Hours:Monday - Friday 11:30amFor more information, please call.",(562) 929-5544,,,,,,,,,Norwalk,12929 Alondra Blvd.,CA,90650,PostalAddress
https://schema.org,LocalBusiness,,,,,St Dominic Savio Church,,,https://www.foodpantries.org/gallery/no_photo_3.jpg,"Food Distribution Hours:Every Thursday 8:00am to 10:00amCanned foods, bread and meats....",(562) 920-7796,,,,,,,,,Bellflower,13400 Bellflower BLVD,CA,90706,PostalAddress
https://schema.org,LocalBusiness,,,,,St George's Church,,,https://www.foodpantries.org/gallery/no_photo_9.jpg,"Hours: The 2nd and 4th Thursday 4:00am - 6:00pmFor more information, please call....",(562) 866-6668,,,,,,,,,Bellflower,15725 Cornuta Ave,CA,90706,PostalAddress
https://schema.org,LocalBusiness,,,,,Holy Redeemer Church,,,https://www.foodpantries.org/gallery/no_photo_7.jpg,"Hours: Friday 9:00am - 10:30am  Sign in at 8:am Canned goods, produce and groceries...",(562) 867-0714,,,,,,,,,Bellflower,14515 Blain ave,CA,90706,PostalAddress
https://schema.org,LocalBusiness,,,,,Warrior Center - Palm Street Park,,,https://www.foodpantries.org/gallery/no_photo_5.jpg,"Food Distribution Hours:  Last Saturday of every month12:00pm to 2:00pmFood available and lunch until gone For more information, please call. ...",(562) 644-2343,,,,,,,,,Bellflower,14515 Blaine Ave.,CA,90706,PostalAddress
https://schema.org,LocalBusiness,,,,,Bethany Church,,,https://www.foodpantries.org/gallery/no_photo_3.jpg,"For more information, please call....",(562) 866-1812,,,,,,,,,Bellflower,17054 Bixby Ave,CA,90706,PostalAddress
https://schema.org,LocalBusiness,,,,,Novato Human Needs Center,,,https://www.foodpantries.org/gallery/24155_novato_human_needs_center_94947_igv.png,Provides a food pantry.  Serves Marin County (primarily Novato and North Marin County) Pantry Hours:Tuesday 1:00 - 3:00pmPlease come in and sign up in advance during our client service hours to fill out a short food pantry application form.,415-897-4147,,,,,,,,,Novato,1907 Novato Blvd,CA,94947,PostalAddress
https://schema.org,LocalBusiness,,,,,San Geronimo Valley Community Center,,,https://www.foodpantries.org/gallery/no_photo_2.jpg,"Provides a food pantry.  Serves Marin County (primarily Forest Knolls, Lagunitas, San Geronimo, Woodacre) Pantry Hours: Monday 9:00am - 5:00pm Thursday2:00pm - 5:00pmFor more information, please call....",(415) 488-8888,,,,,,,,,Nicasio,6350 Sir Francis Drake Boulevard,CA,94963,PostalAddress
https://schema.org,LocalBusiness,,,,,Ritter Center,,,https://www.foodpantries.org/gallery/no_photo_9.jpg,Provides a food pantry.  Serves Marin County (except Canal District). Documentation Required: Photo identification and proof of residency. Pantry Hours: Monday through Friday 9:00am - 3:00pm Wednesday and Friday 3:00pm - 5:30pm...,(415) 457-8182,,,,,,,,,San Rafael,16 Ritter Street,CA,94901,PostalAddress
https://schema.org,LocalBusiness,,,,,The Salvation Army Marin County Corps Community Service Cent,,,https://www.foodpantries.org/gallery/no_photo_6.jpg,"Provides a food pantry.  Serves: Marin County. Documentation Required: Photo identification for each adult in household, proof of residency, proof of income, social security number for each member of household Pantry Hours: Monday-Friday 9:00am - 12:00pm 4th Thursday of every month 9:00am - 12:00pm (USDA government surplus food program) 1st and 3rd Friday of every month 9:00am - 12:00pm (Brown bag food pantry)For more information, please call. ...",(415) 459-4520,,,,,,,,,San Rafael,351 Mission Avenue,CA,94901,PostalAddress
https://schema.org,LocalBusiness,,,,,North Richmond Missionary Baptist Church Food Pantry,,,https://www.foodpantries.org/gallery/no_photo_8.jpg,"Food Pantry Hours:2nd and 4th Friday of the month12:00pm - 2:00pmClosed on holidaysFor more information, please call....",(510) 232-7751,,,,,,,,,Richmond,1427 Fred Jackson Way,CA,94805,PostalAddress
https://schema.org,LocalBusiness,,,,,Sojourner Truth Presbyterian Church Food Pantry,,,https://www.foodpantries.org/gallery/no_photo_5.jpg,"Food Pantry Hours: 3rd Saturday of the month12:00pm - 2:00pmFor more information, please call the pantry....",(510) 222-2020,,,,,,,,,Richmond,2621 Shane Drive,CA,94801,PostalAddress
https://schema.org,LocalBusiness,,,,,The Lighthouse,,,https://www.foodpantries.org/gallery/24149_new_hope_christian_center_93022_oox.png,"Provides a food pantry.  Pantry Hours: The last Tuesday of each month 1:00pm - 3:00pmFor more information, please call.",805-649-2244,,,,,,,,,Oak View,590 Old Ventura Avenue,CA,93022,PostalAddress
https://schema.org,LocalBusiness,,,,,The Lord's Pantry  - Summit Church ,,,https://www.foodpantries.org/gallery/no_photo_10.jpg,"Delivers food from their food pantry throughout east county. Call between 8am and 5pm, leave name, address, phone number and the size of family. Hours: 1st and 3rd Thursday11:00am - 1:00pm. Closed holidays.",(925) 679-1353,,,,,,,,,Oakely,1250 O'Hara Ave,CA,94561,PostalAddress
https://schema.org,LocalBusiness,,,,,California Food and Justice Coalition,,,https://www.foodpantries.org/gallery/144_california-food-and-justice-coalition_arf.jpg,"For more information, please call.",310 822-5410,,,,,,,,,Oakland,398 60th St.,CA,90291,PostalAddress
https://schema.org,LocalBusiness,,,,,Alameda County Community Food Bank,,,https://www.foodpantries.org/gallery/no_photo_10.jpg,Alameda County Community Food Bank distributes food to 275 agencies that provide food assistance to people in need. Their mission is to provide food and nutrition education to those in need within the community. Please contact them for more information on agency locations and eligibility requirements . Office&nbsp; Hours:Monday - Friday 9 am - 5pm Emergency Food Helpline:Monday - Friday 9am - 4pm 800-870-3663,510-635-3663,,,,,,,,,Oakland,7900 Edgewater Drive,CA,94621,PostalAddress
https://schema.org,LocalBusiness,,,,,Covenant House California Crisis Shelter - Oakland,,,https://www.foodpantries.org/gallery/1063_covenant-house-california-crisis-shelter-oakland_ipo.jpg,Los Angeles and Bay Area campuses offer three nutritious home-cooked meals to our residents receive each and every day.,(510) 379-1010,,,,,,,,,Oakland,200 Harrison Street,CA,94607,PostalAddress
https://schema.org,LocalBusiness,,,,,Feed My Sheep,,,https://www.foodpantries.org/gallery/1302_ca-feed-my-sheep_ixi.jpg,"Hours:Third Saturday of each month 12:00pm - 2:00pmNutritional bag lunches  food boxes, and women, men, children clothes are distributed.  Thanksgiving &amp; Christmas, dinner is served.  Call or e-mail ahead in reference to the special dinners. ",(510) 384-8604,,,,,,,,,Oakland,8825 MacArthur Blvd,CA,94605,PostalAddress
https://schema.org,LocalBusiness,,,,,West Oakland Food Pantry - Prescott-Joseph Center,,,https://www.foodpantries.org/gallery/32365_ca-west_oakland_food_pantry_coi.jpg," Hours of Operation: Monday - Friday9:00am - 4:00pmFor more information, please call. ",(510) 208-5651,,,,,,,,,Oakland,920 Peralta Street,CA,94607,PostalAddress
https://schema.org,LocalBusiness,,,,,CID Project of the East Bay- Oakland,,,https://www.foodpantries.org/gallery/38140_cid_project_-Oaklan-94612_iog.jpg,"Provides advocacy and support to CID clients. Services include a Wellness Clinic that offers primary care, food pantry, housing, funds for utilities, access to counseling, crisis intervention, long-term case management and agency referrals. Services are free.  Hours: Monday - Friday 9:30am - 12:30pm; 1:30pm - 5:30 pmFor more information, please call. ",(510) 663-7979,,,,,,,,,Oakland,1320 Webster Street,CA,94612,PostalAddress
https://schema.org,LocalBusiness,,,,,Help of Ojai,,,https://www.foodpantries.org/gallery/24100_help_of_ojai_93024_rzn.png,Provides a food pantry.  Pantry Hours: Monday to Friday 8:30am to 12:00pm and 1:00pm to 5:00pm,805.646.5122,,,,,,,,,Ojai,111 W. Santa Ana Street,CA,93023,PostalAddress
https://schema.org,LocalBusiness,,,,,First Baptist Church,,,https://www.foodpantries.org/gallery/24070_first_baptist_church_93023_lyv.png,Provides a food pantry.  Pantry Hours: 4th Saturday of the month 10:00am to 11:30amPlease Call Previous Monday.,(805) 646-3333,,,,,,,,,Ojai,930 Grand Avenue,CA,93023,PostalAddress
https://schema.org,LocalBusiness,,,,,The Lighthouse,,,https://www.foodpantries.org/gallery/no_photo_3.jpg,"Provides a food pantry.  Pantry Hours: The last Tuesday of each month 1:00pm - 3:00pmFor more information, please call....",805-649-2244,,,,,,,,,Oak View,590 Old Ventura Avenue,CA,93022,PostalAddress
https://schema.org,LocalBusiness,,,,,Temple Beth Torah,,,https://www.foodpantries.org/gallery/no_photo_8.jpg,Provides a food pantry.  Pantry Hours: Tuesday 8:00am-10:30am...,805-647-4181,,,,,,,,,Ventura,7620 Foothill Road,CA,93004,PostalAddress
https://schema.org,LocalBusiness,,,,,Community Presbyterian Church,,,https://www.foodpantries.org/gallery/no_photo_6.jpg,"Provides a food pantry.  Pantry Hours: Thursday10:30am to 12:00pmFor more information, please call....",805-648-2737,,,,,,,,,Ventura,1555 Poli Street,CA,93001,PostalAddress
https://schema.org,LocalBusiness,,,,,Family To Family,,,https://www.foodpantries.org/gallery/no_photo_9.jpg,"Provides a food pantry.  Pantry hours: Monday, Wednesday and Friday from 11:30am to 12:30pm Saturday and Sunday breakfast only from 8:00am to 9:00am...",805-658-2610,,,,,,,,,Ventura,303 N. Ventura Ave,CA,93001,PostalAddress
https://schema.org,LocalBusiness,,,,,Catholic Charities Ventura,,,https://www.foodpantries.org/gallery/no_photo_3.jpg,Provides a food pantry.  Pantry Hours: Tuesday and Thursday 9am to 12:00pm and 1:00pm to 3:00pm ...,805-643-4694,,,,,,,,,Ventura,303 N. Ventura Avenue,CA,93001,PostalAddress
https://schema.org,LocalBusiness,,,,,Bridge Community Church Food Pantry,,,https://www.foodpantries.org/gallery/24333_zion_christian_center_92866_gtl.jpg,"Provides a food pantry.Hours:The 1st and 3rd Wednesday of each month10:00am - 1:00pmIn addition, we have a a Kidz Kloset. The closet assists parents by providing clothing and toys for kids 0-12 years.For more information, please call. ",(714) 997-8881,,,,,,,,,Orange,710 S Cambridge Street,CA,92866,PostalAddress
https://schema.org,LocalBusiness,,,,,St Norberts Christian Services,,,https://www.foodpantries.org/gallery/24253_st_norberts_christian_services_92865_dje.png,Provides a food pantry.  Must live within parish boundaries. Pantry Hours: Saturday Hot Meal 12:30pm - 2:00pmOn call 7 days,(714) 637-4360,,,,,,,,,Orange,300 E. Taft Ave,CA,92865,PostalAddress
https://schema.org,LocalBusiness,,,,,St Johns Lutheran Church,,,https://www.foodpantries.org/gallery/24247_st_johns_lutheran_church_92866_lvi.png,Provides a food pantry.  Bring ID. Pantry Hours: Saturday 8:00am - 10:00am (closed last Saturday of the month),714-2287-8440,,,,,,,,,Orange,154 S. Shaffer St.,CA,92866,PostalAddress
https://schema.org,LocalBusiness,,,,,Praise Chapel,,,https://www.foodpantries.org/gallery/24173_praise_chapel_92868_qts.png,Provides a food pantry.  Pantry Hours: Thursday5:00pm,714-588-1577,,,,,,,,,Orange,1125 W Alvarez Ave,CA,92868,PostalAddress
https://schema.org,LocalBusiness,,,,,River 47,,,https://www.foodpantries.org/gallery/24184_river_47_92869_esv.jpg,Provides a food pantry.  Call for appointment once a month.Hours:Tuesday and Thursday9:00am - 2:00pm,714-633-6464x10,,,,,,,,,Orange,250 S. Prospect Ave,CA,92869,PostalAddress
https://schema.org,LocalBusiness,,,,,Orange Elderly Services Inc,,,https://www.foodpantries.org/gallery/24160_orange_elderly_services_inc_92866_tqk.jpg,"Provides a food pantry.  Seniors only. Pantry Hours: Emergency Food 3rd Tuesday of the month 9:00amFor more information, please call.",(714) 538-9633,,,,,,,,,Orange,170 S Olive St,CA,92866,PostalAddress
https://schema.org,LocalBusiness,,,,,Orange Hills Assembly,,,https://www.foodpantries.org/gallery/24161_orange_hills_assembly_92867_utb.png,Provides a food pantry. Pantry Hours:Monday through Thursday 10:00am to 2:00pm ,714-974-7333,,,,,,,,,Orange,2910 N Santiago Blvd,CA,92867,PostalAddress
https://schema.org,LocalBusiness,,,,,Marys Kitchen - Orange Cares,,,https://www.foodpantries.org/gallery/24140_marys_kitchen_orange_cares_92866_klv.png,Provides a food pantry.  Pantry Hours: Hot meals Monday - Friday8:00am - 2:00pm Except Wednesday 10:00am - 2:00pm; Clients 9:00 - 3:00pm,714-633-0444,,,,,,,,,Orange,517 W. Struck Ave,CA,92867,PostalAddress
https://schema.org,LocalBusiness,,,,,Trinity Guild - La Purisima Catholic Church,,,https://www.foodpantries.org/gallery/24128_la_purisima_trinity_guild_92869_cji.jpg,"Provides a food pantry.  Orange County only. Pantry Hours: Monday, and Friday 10:00am - 12:00pm 1st, 3rd and 5th Wednesday of the month10:00am - 12:00pm2nd and 4th Wednesday - Mobile Pantry8:30am - 10:30pm(In the parking lot behind the parish office)Thanksgiving Dinners Distribution:Sunday before Thanksgiving",(714) 633-5800,,,,,,,,,Orange,11712 N. Hewes Street,CA,92869,PostalAddress
https://schema.org,LocalBusiness,,,,,Friendly Center,,,https://www.foodpantries.org/gallery/24083_friendly_center__zdm.jpg,"Provides a food pantry.Serves: 92865 only. Pantry Hours: Emergency Food 2nd Friday of the monthMonday and Thursday 10:00amFor more information, please call. ",(714) 771-5300,,,,,,,,,Orange,1820 E Meats Ave.,CA,92867,PostalAddress
https://schema.org,LocalBusiness,,,,,Christian Life Fellowship,,,https://www.foodpantries.org/gallery/no_photo_8.jpg,Provides a food pantry.  By application only. Pantry Hours: Saturday 9:30am - 11:30am,714-771 9850,,,,,,,,,Orange,1090 N. Batavia St.,CA,92867,PostalAddress
https://schema.org,LocalBusiness,,,,,Calvary Temple,,,https://www.foodpantries.org/gallery/no_photo_8.jpg,Provides a food pantry.  Pantry Hours: As needed Monday - Friday 9:00am - 5:00pm,714-538-1064,,,,,,,,,Orange,308 S Glassell Street,CA,92866,PostalAddress
https://schema.org,LocalBusiness,,,,,First Presbyterian Church of Orange,,,https://www.foodpantries.org/gallery/23961_1st_presbyterian_church_of_orange_92866_cvg.jpg,"Provides a food pantry.  Pantry Hours:Wednesday10:00am - 12:00pm; 1:00pm - 3:00pmLimit is 2 bags per month per person/household.For more information, please call.",(714) 583-2341,,,,,,,,,Orange,191 N Orange St,CA,92866,PostalAddress
