@context,@type,url,sameAs,contactPoint,alternateName,name,itemListElement,address,image,description,telephone,contactPoint_@type,contactPoint_contactType,contactPoint_email,contactPoint_url,itemListElement_item_name,itemListElement_position,itemListElement_@type,itemListElement_item_@id,address_addressLocality,address_streetAddress,address_addressRegion,address_postalCode,address_@type
https://schema.org,LocalBusiness,,,,,River City Food Bank,,,https://www.foodpantries.org/gallery/no_photo_1.jpg,"Hours: Monday-Friday 11:30am - 3:00pm   River City Food Bank is the oldest, continuously serving food bank in Sacramento and the only Sacramento-area food bank open every week day to anyone experiencing hunger from anywhere in Sacramento County. RCFB offers a nutritionally-balanced 3-day emergency supply of food, as well as compassion  ¦and hope.For more information, please call. ...",(916) 446-2627,,,,,,,,,Sacramento,1800 28th Street,CA,95816,PostalAddress
https://schema.org,LocalBusiness,,,,,Cordova Community Food Locker,,,https://www.foodpantries.org/gallery/no_photo_10.jpg,"Provides individuals and families in need in the community with a free emergency supply of food. Individuals come from all walks of life, including the unemployed, seniors, disabled, homeless, working poor, and new immigrants. Service Hours: Mon, Wed & Fri 9:30 a.m. until 1:20 p.m.CLOSED HOLIDAYS & Good FridayDocuments needed:Evidence of residency. Ex: driver license, a utility bill, etc. Provide identification for all recipients of the food....",(916) 364-8973,,,,,,,,,Rancho Cordova,10497 Coloma Road,CA,95670,PostalAddress
https://schema.org,LocalBusiness,,,,,Emeryville Citizens Assistance Program - ECAP,,,https://www.foodpantries.org/gallery/35928_emeryville-citizens-assistance-program-ecap_tdk.png,"Open five days a week.Hours:Monday thru Thursday and Saturday 11:00am - 3:00pmECAP is more than a food pantry. We believe food is the most basic human right. Everyone should have access to food. Everyone, everyday. We want our community to thrive. To grow. To be healthy. It starts with access to food.   After filling this basic need, our clients are able to consider what they want to do differently, what services in the community they can take advantage of, what it will take to make the next big step--whether th",(510) 499-1263,,,,,,,,,Emeryville,3610 San Pablo Ave,CA,94608,PostalAddress
https://schema.org,LocalBusiness,,,,,West Oakland Food Pantry - Prescott-Joseph Center,,,https://www.foodpantries.org/gallery/no_photo_6.jpg," Hours of Operation: Monday - Friday9:00am - 4:00pmFor more information, please call. ...",(510) 208-5651,,,,,,,,,Oakland,920 Peralta Street,CA,94607,PostalAddress
https://schema.org,LocalBusiness,,,,,CID Project of the East Bay- Oakland,,,https://www.foodpantries.org/gallery/no_photo_10.jpg,"Provides advocacy and support to CID clients. Services include a Wellness Clinic that offers primary care, food pantry, housing, funds for utilities, access to counseling, crisis intervention, long-term case management and agency referrals. Services are free.  Hours: Monday - Friday 9:30am - 12:30pm; 1:30pm - 5:30 pmFor more information, please call. ...",(510) 663-7979,,,,,,,,,Oakland,1320 Webster Street,CA,94612,PostalAddress
https://schema.org,LocalBusiness,,,,,Berkeley Food Pantry,,,https://www.foodpantries.org/gallery/no_photo_1.jpg,"HoursMonday, Wednesday, and Friday2:00pm - 4:00pmBerkeley Food Pantry distribute monthly bags of emergency groceries to Albany and Berkeley, CA residents in need. We offer food from the USDA Emergency Food Assistance Program, food purchased from the Alameda County Community Food Bank, food donated by local grocery stores and businesses, individuals, and local gleaners. In addition to an assortment of shelf stable food, we are fortunate to be able to offer our visitors a selection of fresh produce, dairy, bread, and f...",(510) 525-2280,,,,,,,,,Berkeley,1600 Sacramento Street,CA,94702,PostalAddress
https://schema.org,LocalBusiness,,,,,East Gibson Food Pantry,,,https://www.foodpantries.org/gallery/no_photo_6.jpg,"The East Gibson Food Pantry is located at Trinity United Methodist Church. For more information, please call....",812-795-2624,,,,,,,,,Oakland City,210 Harrison St,IN,47660,PostalAddress
https://schema.org,LocalBusiness,,,,,Covenant House California Crisis Shelter - Oakland,,,https://www.foodpantries.org/gallery/no_photo_5.jpg,Los Angeles and Bay Area campuses offer three nutritious home-cooked meals to our residents receive each and every day....,(510) 379-1010,,,,,,,,,Oakland,200 Harrison Street,CA,94607,PostalAddress
https://schema.org,LocalBusiness,,,,,St. John the Evangelist Catholic Church,,,https://www.foodpantries.org/gallery/35886_st-john-the-evangelist-catholic-church_xly.png,"Pantry Hours:  Monday 9:00am - 1:00pmExcept on the 3rd week of the monthTuesday on the 3rd week of the month12:30pm - 2:00pmThe Pantry is located in the trailer to the east of the Church parking lot. For more information, please call. ",(760) 753-6254,,,,,,,,,Encinitas,1001 Encinitas Boulevard,CA,92024,PostalAddress
https://schema.org,LocalBusiness,,,,,Community Resource Center San Diego,,,https://www.foodpantries.org/gallery/37503_community-resource-center-san-diego_rsv.png,"Available Food and Nutrition Assistance programs:  USDA Commodities Program: USDA food distributed daily; one monthly allotment per family, eligibility based on income.  CalFresh (Food Stamp) and Medi-Cal application assistance.  Weekly Food Assistance Clients who are working with an Integrative Services Case Manager to develop and work towards a plan leading to self-reliance, are eligible to receive weekly food assistance. Seniors and individuals who are unable to work because of a disability are able to utilize this resource, as well. ",(760) 753-1156,,,,,,,,,Encinitas,650 Second Street,CA,92024,PostalAddress
https://schema.org,LocalBusiness,,,,,Growing MInds Early Education Programs,,,https://www.foodpantries.org/gallery/no_photo_8.jpg," North County Community Services (NCCS) is a nonprofit organization in Northern San Diego County.  NCCS is passionately committed to improving our neighbors health and well being by providing programs that educate young children, support working families, provide food for those feeding the hungry and ultimately create opportunities to improve the quality of life for residents of North County.  ï»¿...",(760) 471-5483,,,,,,,,,San Marcos,"1557 Grand Avenue, Suite C",CA,92069,PostalAddress
https://schema.org,LocalBusiness,,,,,San Diego Food Bank,,,https://www.foodpantries.org/gallery/no_photo_7.jpg,Administrative Office Hours:Monday - Friday8:00am - 5:00pm ...,(858) 527-1419,,,,,,,,,San Diego,9850 Distribution Ave,CA,92121,PostalAddress
https://schema.org,LocalBusiness,,,,,Oak Hill Church of Christ Feed My Sheep,,,https://www.foodpantries.org/gallery/no_photo_3.jpg,"We are blessed to announce that the Lord has provided a way for Oak Hill to continue reaching out to those who are hungry in our community. Hours: 2nd & 4th Monday 11:00am to 1:00pmDistribute food, clothing and God's love.   We will also go out in the community with blessing bags of sandwiches, fruit, snacks and bottled water on a regular basis.  We are always received with hearts of gratitude because the Lord is good!  We welcome all people to the Lord's table of grace!  We meet on Fridays at 6pm for a hot meal, pra...",(760) 741-2758,,,,,,,,,Escondido,1301 Oak Hill Drive,CA,92027,PostalAddress
https://schema.org,LocalBusiness,,,,,Hand Up Youth Food Pantry at JFS,,,https://www.foodpantries.org/gallery/no_photo_3.jpg,"Led by a dynamic committee of teenagers, the food pantry delivers food throughout San Diego County while case managers at distribution sites provide support, referral, and assistance toward achieving a higher level of self-sufficiency.Requirements:Photo ID...",(858) 637-3088,,,,,,,,,San Diego,8804 Balboa Avenue,CA,92123,PostalAddress
https://schema.org,LocalBusiness,,,,,Metro United Methodist Urban Ministry,,,https://www.foodpantries.org/gallery/no_photo_7.jpg,"For more information, please call....",(619) 285-5556,,,,,,,,,San Diego,6154 Mission Gorge Road,CA,92120,PostalAddress
https://schema.org,LocalBusiness,,,,,C.A.R.E. Food Bank,,,https://www.foodpantries.org/gallery/no_photo_8.jpg,"Weekly Emergency Supplemental FoodHours:First, Second, Fourth and (when applicable) fifth Wednesday of each month 9:45am - 10:30 amThe C.A.R.E. program is open for the residents of Escalon &amp; Farmington who need food and whose income meets the Federal poverty level (Self-reporting of income is required).&nbsp; A bag of food is provided free, one for each household.&nbsp; Currently we are providing for over 100 households a week.",(209) 838-3831,,,,,,,,,Escalon,1531 2nd Street,CA,95320,PostalAddress
https://schema.org,LocalBusiness,,,,,Oak Hill Church of Christ Feed My Sheep,,,https://www.foodpantries.org/gallery/36903_oak-hill-church-of-christ-feed-my-sheep_qdi.jpg,"We are blessed to announce that the Lord has provided a way for Oak Hill to continue reaching out to those who are hungry in our community. Hours: 2nd & 4th Monday 11:00am to 1:00pmDistribute food, clothing and God's love.   We will also go out in the community with blessing bags of sandwiches, fruit, snacks and bottled water on a regular basis.  We are always received with hearts of gratitude because the Lord is good!  We welcome all people to the Lord's table of grace!  We meet on Fridays at 6pm for a hot meal, pra",(760) 741-2758,,,,,,,,,Escondido,1301 Oak Hill Drive,CA,92027,PostalAddress
https://schema.org,LocalBusiness,,,,,Growing MInds Early Education Programs,,,https://www.foodpantries.org/gallery/no_photo_2.jpg," North County Community Services (NCCS) is a nonprofit organization in Northern San Diego County.  NCCS is passionately committed to improving our neighbors health and well being by providing programs that educate young children, support working families, provide food for those feeding the hungry and ultimately create opportunities to improve the quality of life for residents of North County.  ï»¿...",(760) 471-5483,,,,,,,,,San Marcos,"1557 Grand Avenue, Suite C",CA,92069,PostalAddress
https://schema.org,LocalBusiness,,,,,St. John the Evangelist Catholic Church,,,https://www.foodpantries.org/gallery/no_photo_5.jpg,"Pantry Hours:  Monday 9:00am - 1:00pmExcept on the 3rd week of the monthTuesday on the 3rd week of the month12:30pm - 2:00pmThe Pantry is located in the trailer to the east of the Church parking lot. For more information, please call. ...",(760) 753-6254,,,,,,,,,Encinitas,1001 Encinitas Boulevard,CA,92024,PostalAddress
https://schema.org,LocalBusiness,,,,,Community Resource Center San Diego,,,https://www.foodpantries.org/gallery/no_photo_10.jpg,"Available Food and Nutrition Assistance programs:  USDA Commodities Program: USDA food distributed daily; one monthly allotment per family, eligibility based on income.  CalFresh (Food Stamp) and Medi-Cal application assistance.  Weekly Food Assistance Clients who are working with an Integrative Services Case Manager to develop and work towards a plan leading to self-reliance, are eligible to receive weekly food assistance. Seniors and individuals who are unable to work because of a disability are able to utilize this resource, as well. ...",(760) 753-1156,,,,,,,,,Encinitas,650 Second Street,CA,92024,PostalAddress
https://schema.org,LocalBusiness,,,,,San Diego Food Bank,,,https://www.foodpantries.org/gallery/no_photo_8.jpg,Administrative Office Hours:Monday - Friday8:00am - 5:00pm ...,(858) 527-1419,,,,,,,,,San Diego,9850 Distribution Ave,CA,92121,PostalAddress
https://schema.org,LocalBusiness,,,,,Hand Up Youth Food Pantry at JFS,,,https://www.foodpantries.org/gallery/no_photo_5.jpg,"Led by a dynamic committee of teenagers, the food pantry delivers food throughout San Diego County while case managers at distribution sites provide support, referral, and assistance toward achieving a higher level of self-sufficiency.Requirements:Photo ID...",(858) 637-3088,,,,,,,,,San Diego,8804 Balboa Avenue,CA,92123,PostalAddress
https://schema.org,LocalBusiness,,,,,St Mark's Lutheran Church - Manna Food Pantry,,,https://www.foodpantries.org/gallery/24250_st_marks_lutheran_church_94533_snn.jpg,Provides a food pantry.  Serves Solano County (Fairfield).Pantry Hours: Tuesday 4:00pm - 6:00pmThe 2nd Saturday of every month 9:30am - 10:30am,(707) 422-4741,,,,,,,,,Fairfield,1600 Union Avenue,CA,94533,PostalAddress
https://schema.org,LocalBusiness,,,,,Seventh Day Adventist Community Services - Seventh Day Adven,,,https://www.foodpantries.org/gallery/24215_seventh_day_adventist_community_services_seventh_day_adven_94533_rdw.jpg,"Provides a food pantry.  Serves: Solano County. Documentation Required: Photo identification or Social Security card. Pantry Hours: 2nd Wednesday of every month 11:00am - 1:00pm (Seniors), 4th Wednesday of every month: 11:00am - 1:00pm (Families)",(707) 426-6720,,,,,,,,,Fairfield,1101 East Tabor Avenue,CA,94533,PostalAddress
https://schema.org,LocalBusiness,,,,,Samoan Christian Fellowship Assembly of God,,,https://www.foodpantries.org/gallery/no_photo_8.jpg,"Distribute grocery items.Hours:Wednesday and Friday 11:00am to 1:00pmFor more information, please call. ",(707) 428-4221,,,,,,,,,Fairfield,1200 Western Street,CA,94533,PostalAddress
https://schema.org,LocalBusiness,,,,,First Baptist Church of Vacaville,,,https://www.foodpantries.org/gallery/no_photo_1.jpg,"Provides a food pantry.  Serves Solano County (Vacaville) Pantry Hours: Monday10:00am - 12:00pmWednesday 5:30pm to 7:00pmFriday10:00am - 12:00pmEmergency Hours:Monday - Wednesday9:00am - 3:00pmDonations and Volunteering:Please contact Deacon David Bethea.For more information, please call. ...",(707) 448-6209,,,,,,,,,Vacaville,1127 Davis Street,CA,95687,PostalAddress
https://schema.org,LocalBusiness,,,,,Vaca Fish Food Bank,,,https://www.foodpantries.org/gallery/no_photo_2.jpg,"Pantry HoursTuesday - Friday10:00pm and 12:00pmFood order requests received 10:00am - 11:30amRequirements:identification and pick up their food on the same day ordered.For&nbsp; more information, please call. ...",(707) 447-5482,,,,,,,,,Vacaville,40 Eldridge Ave. ,CA,95688,PostalAddress
https://schema.org,LocalBusiness,,,,,"Community Presbyterian Church, Vacaville",,,https://www.foodpantries.org/gallery/no_photo_8.jpg,"Provides a food pantry.  Serves: Solano County (Vacaville). Documentation Required: Identification with proof of residency in area served and proof of need where appropriate Pantry Hours: Monday-Friday 9:00am - 12:00pm and 1:00pm - 4:00pmFor more information, please call. ...",(707) 448-5055,,,,,,,,,Vacaville,425 Hemlock Street,CA,95688,PostalAddress
https://schema.org,LocalBusiness,,,,,St Mary's Catholic Church,,,https://www.foodpantries.org/gallery/no_photo_8.jpg,"Provides a food pantry.  Serves Solano County (Elmira, Vacaville). Documentation Required: Proof of residency Pantry Hours: Monday and Wednesday 10:00am - 11:45am...",(707) 448-2390,,,,,,,,,Vacaville,350 Stinson Avenue,CA,95688,PostalAddress
https://schema.org,LocalBusiness,,,,,Vacaville Storehouse,,,https://www.foodpantries.org/gallery/no_photo_9.jpg,"Provides a food pantry.  Serves Solano Coounty (Vacaville). Documentation Required: Proof of residence, income verification and family information.  The Vacaville Storehouse is a distribution center for food and clothing to families in need in Vacaville, CA.  Pantry Hours:      Monday, Thursday and Friday 10:00am - 12:00pmTuesday 4:00pm - 6:00pm  ...",(707) 454-0268,,,,,,,,,Vacaville,1146 E. Monte Vista Ave.,CA,95688,PostalAddress
https://schema.org,LocalBusiness,,,,,Mountain Community Resources,,,https://www.foodpantries.org/gallery/36259_mountain-community-resources_hvi.png,"Fresh, local organic produce, protein-rich foods, whole grains and more are available to the community every Thursday.HOURS11:0am to 12:00pm.",831-335-6600,,,,,,,,,Felton,6134 Hwy 9 6134 Hwy 9,CA,95018,PostalAddress
https://schema.org,LocalBusiness,,,,,St Francis Of Assisi,,,https://www.foodpantries.org/gallery/no_photo_9.jpg,Provides a food pantry.  Pantry Hours: Tuesday 10:00am-11:00am,805-524-1306,,,,,,,,,Fillmore,1048 W. Ventura Street,CA,93015,PostalAddress
https://schema.org,LocalBusiness,,,,,Fillmore Senior Center,,,https://www.foodpantries.org/gallery/no_photo_4.jpg,Provides a food pantry.  Pantry Hours: 3rd Wednesday of every month 9:00am - 11:00am,805-524-4533,,,,,,,,,Fillmore,533 Santa Clara St.,CA,93015,PostalAddress
https://schema.org,LocalBusiness,,,,, Moorpark Pantry Plus - Catolic Charities of Los Angeles,,,https://www.foodpantries.org/gallery/no_photo_9.jpg,Provides a food pantry.  Pantry Hours: Monday - Thursday 9:00am - 1:30pmSaturday9:00am - 1:00pm...,805-529-0720,,,,,,,,,Moorpark,612 Spring Rd  Suite 101,CA,93021,PostalAddress
https://schema.org,LocalBusiness,,,,,Santa Clara Valley NFL,,,https://www.foodpantries.org/gallery/no_photo_4.jpg,"Provides a food pantry.  Pantry Hours:The 1st Friday of the month 2:00pm to 3:00pmThe 2nd, 3rd and 4th Friday of the month 9:00am to 12:00pmFor more information, please call....",805-933-9800,,,,,,,,,Santa Paula,217 N. 10th Street,CA,93060,PostalAddress
https://schema.org,LocalBusiness,,,,,Community Assistance of Santa Paula,,,https://www.foodpantries.org/gallery/no_photo_2.jpg,Provides a food pantry.  Pantry Hours: Monday 8:00am - 12:00pm...,805-525-8890,,,,,,,,,Santa Paula,133 N. Mill Street,CA,93060,PostalAddress
https://schema.org,LocalBusiness,,,,,St Sebastians - St Vincent,,,https://www.foodpantries.org/gallery/no_photo_1.jpg,Provides a food pantry.  Pantry Hours: Thursday1:00pm to 4:30pm...,(805) 525-2149,,,,,,,,,Santa Paula,235 N. 9th Street,CA,93060,PostalAddress
https://schema.org,LocalBusiness,,,,,Many Meals of Santa Paula,,,https://www.foodpantries.org/gallery/no_photo_4.jpg,"Provides a food pantry.  Pantry Hours: WednesdayFor more information, please call....",(805) 525-6654,,,,,,,,,Santa Paula,121 Davis Street,CA,93060,PostalAddress
https://schema.org,LocalBusiness,,,,,Twin Lakes Food Bank Inc.,,,https://www.foodpantries.org/gallery/646_twin-lakes-food-bank-inc_ktx.JPG,Hours:Tuesday 9:00am-12:30pm &amp; 4:30pm-6:00pmWednesday9:00am-12:00pmThursday 9:00am-12:30pm,(916) 985-6232,,,,,,,,,Folsom,327 Montrose Drive Suite A,CA,95630,PostalAddress
https://schema.org,LocalBusiness,,,,,Orangevale Food Bank,,,https://www.foodpantries.org/gallery/no_photo_10.jpg,"Hours: Wednesday   4:30pm and 6:30 pm Thursday 9:00am and 12:30pm. We  hope to keep our shelves full to be able to meet as many needs as we  can, but cannot guarantee it. What we can guarantee is that someone will  be available to provide resources for you as you work toward getting  back on your feet. Door to Door Program  Residents unable to travel our location may be eligible for our Door To  Door Program.Eligibility  Any family residing in Orangevale or Fair Oaks will be eligible to  receiv...",(916) 304-3663,,,,,,,,,Orangevale,6483 Main Avenue,CA,95662,PostalAddress
https://schema.org,LocalBusiness,,,,,Sunrise Christian Food Ministries ,,,https://www.foodpantries.org/gallery/no_photo_9.jpg,"Serves: Citrus Heights, Fair Oaks, &amp; Orangevale since 1983.Hours:Monday - Friday 11:30am-3:00pmFor more information, please call. ...",(916) 965-5431,,,,,,,,,Citrus Heights,5901 San Juan Ave,CA,95610,PostalAddress
https://schema.org,LocalBusiness,,,,,Cordova Community Food Locker,,,https://www.foodpantries.org/gallery/no_photo_5.jpg,"Provides individuals and families in need in the community with a free emergency supply of food. Individuals come from all walks of life, including the unemployed, seniors, disabled, homeless, working poor, and new immigrants. Service Hours: Mon, Wed & Fri 9:30 a.m. until 1:20 p.m.CLOSED HOLIDAYS & Good FridayDocuments needed:Evidence of residency. Ex: driver license, a utility bill, etc. Provide identification for all recipients of the food....",(916) 364-8973,,,,,,,,,Rancho Cordova,10497 Coloma Road,CA,95670,PostalAddress
https://schema.org,LocalBusiness,,,,,Carmichael Food Closet,,,https://www.foodpantries.org/gallery/no_photo_1.jpg,"Our Food Closet ministry was established in 1973 to assist the hungry folk in Sacramento''s north area. We provide food items for a three-day balanced menu (breakfast, lunch, and dinner) for singles and families.Serves: 95608, 95610, 95621, 95628, 95821, 95841, 95825, 95864..Hours: Monday through Fridays (except holidays)Call 10:00am and 12:00pmTo place your order and&nbsp; plan to pick it up from 2:00pm to 3:30pm that same day.You may receive food once a month for six months in a 12-month perio...",(916) 483-9232,,,,,,,,,Carmichael,5645 Marconi Ave,CA,95608,PostalAddress
https://schema.org,LocalBusiness,,,,,Food Bank Of El Dorado County,,,https://www.foodpantries.org/gallery/no_photo_8.jpg,"Office Hours:Monday- Friday8:00am- 4:00pmDonation Hours:8:00am- 3:00pmFor more information, please call....",(530) 621-9950,,,,,,,,,Cameron Park,4550 Business Drive,CA,95682,PostalAddress
https://schema.org,LocalBusiness,,,,,Elijah's Jar Food Closet,,,https://www.foodpantries.org/gallery/33806_elijahs-jar-food-closet_eyo.jpg,"Elijah's Jar is the only permanent year-round food closet in the Foresthill area. We serve low income families, seniors, homeless, and disabled residents of the Foresthill Divide regardless of age, gender, ethnicity, or religion. This includes the foothill communities of Iowa Hill, Michigan Bluff, Baker Ranch and Yankee Jim as well as Foresthill. We are an isolated community without any scheduled transportation system. Our clients without their own transportation would be in very serious need if we were not there to help. We are currently a",(530) 367-3085,,,,,,,,,Foresthill,24617 Foresthill Rd,CA,95631,PostalAddress
https://schema.org,LocalBusiness,,,,,Food for Thought Sonoma County AIDS Food Bank,,,https://www.foodpantries.org/gallery/32781_food-for-thought-sonoma-county-aids-food-bank_ixl.jpg,"Food For Thought offers comprehensive nutritional services to 650 individuals affected by  disabling HIV/AIDS in Sonoma County. Our services are confidential and are provided to clients at no cost in a welcoming and beautiful environment. Food Bank programs include weekly groceries and fresh produce; vitamins and nutritional supplements; delivery to the homebound; frozen meals for the very ill; nutritional counseling; organic gardening project; cooking and nutrition classes; recipes and nutritional updates, and occasional social gatherings.",(707) 887-1647,,,,,,,,,Forestville,6550 Railroad Avenue,CA,95436,PostalAddress
https://schema.org,LocalBusiness,,,,,Fort Bragg Food Bank,,,https://www.foodpantries.org/gallery/no_photo_6.jpg,"The Fort Bragg Food Bank in Fort Bragg, California, distributes free emergency groceries to people in need. For more information, please call.",707-964-9404,,,,,,,,,Fort Bragg,910 North Franklin St,CA,95437,PostalAddress
https://schema.org,LocalBusiness,,,,,St Joseph's Pantry Shelf,,,https://www.foodpantries.org/gallery/24249_st_josephs_pantry_shelf_95540_gwy.jpg,"Provides a food pantry.  Pantry Hours: Monday, Wednesday and Friday 9:30am - 11:30pmFor more information, please call. ",(707) 725-1148,,,,,,,,,Fortuna,2292 Newburg Road,CA,95540,PostalAddress
https://schema.org,LocalBusiness,,,,,Trinity County Food Bank - Community Church,,,https://www.foodpantries.org/gallery/no_photo_8.jpg,Hours:1st Thursday of every month11:00am - 12:00pm...,,,,,,,,,,Coffe Creek,420 Coffe Creek Rd,CA,96091,PostalAddress
https://schema.org,LocalBusiness,,,,,Arcata Pantry (Trinity Baptist Church),,,https://www.foodpantries.org/gallery/no_photo_2.jpg,"Hours: Wednesday 4:00pm - 6:00pmNo documentation required to receive food.  Can only receive aid one time per month. For more information, please call....",(707) 445-3166,,,,,,,,,Arcata,2450 Alliance Rd,CA,95521,PostalAddress
https://schema.org,LocalBusiness,,,,,Southern California Indian Center,,,https://www.foodpantries.org/gallery/24228_southern_california_indian_center_92708_fms.png,Provides a food pantry.  American Indians residing in OC or 92708 residents only. Pantry Hours: Monday - Friday 8:00am - 5:00pm,714-962-6673,,,,,,,,,Fountain Valley,10175 Slater Ave #175,CA,92708,PostalAddress
https://schema.org,LocalBusiness,,,,,St Vincent de Paul - SVDP Church,,,https://www.foodpantries.org/gallery/no_photo_4.jpg,"Provides a food pantry.  Food Pantry Hours: Monday 9:30-10:30am  Office Hours:Monday 11:00am - 12:00pmSaturday10:00am - 11:00amFor more information, please call. ...",(714) 842-3000,,,,,,,,,Huntington Beach,8345 Talbert Ave,CA,92646,PostalAddress
https://schema.org,LocalBusiness,,,,,Catholic Charities of Orange County - Cantlay ,,,https://www.foodpantries.org/gallery/no_photo_10.jpg,"Provides a food pantry.  Orange County residents. Pantry Hours: 7:30 amRequirements:Bring photo ID, first come first served...",714-668-1130,,,,,,,,,Santa Ana,3631 West Warner Ave.,CA,92704,PostalAddress
https://schema.org,LocalBusiness,,,,,Archangel Michael Coptic,,,https://www.foodpantries.org/gallery/no_photo_5.jpg,Provides a food pantry.  Pantry Hours: Wednesday 2:00pm...,714-775-1234,,,,,,,,,Santa Ana,4405 W. Edinger,CA,92704,PostalAddress
https://schema.org,LocalBusiness,,,,,Refuge Calvary Chapel,,,https://www.foodpantries.org/gallery/no_photo_3.jpg,"We try to provide our guests with fresh fruit, vegetables, eggs, breads, pastries and more. Please bring your own bags. Hours:Monday and Tuesday 2:00pm - 3:30pmFor more information, please call. ...",(714) 891-9495,,,,,,,,,Huntington Beach,7800 Edinger Ave.,CA,92647,PostalAddress
