@context,@type,url,sameAs,contactPoint,alternateName,name,itemListElement,address,image,description,telephone,contactPoint_@type,contactPoint_contactType,contactPoint_email,contactPoint_url,itemListElement_item_name,itemListElement_position,itemListElement_@type,itemListElement_item_@id,address_addressLocality,address_streetAddress,address_addressRegion,address_postalCode,address_@type
https://schema.org,LocalBusiness,,,,,God's Extended Hand - San Diego,,,https://www.foodpantries.org/gallery/no_photo_9.jpg,"Breakfast and dinner are provided for those attending the proceeding Christian worship service. Emergency winter over-night shelter. Periodic free medical clinic, legal aid for disability assistance. Monthly mental health/addiction consultations. Community emergency aid, free food pantry, free haircuts.",(619) 237-0079,,,,,,,,,San Diego,1625 Island Avenue,CA,92101,PostalAddress
https://schema.org,LocalBusiness,,,,,God's Extended Hand - San Diego,,,https://www.foodpantries.org/gallery/38204_gods_extende-San_Di-92101_yoe.jpg,"Breakfast and dinner are provided for those attending the proceeding Christian worship service. Emergency winter over-night shelter. Periodic free medical clinic, legal aid for disability assistance. Monthly mental health/addiction consultations. Community emergency aid, free food pantry, free haircuts.For more information, please call.",(619) 237-0079,,,,,,,,,San Diego,1625 Island Avenue,CA,92101,PostalAddress
https://schema.org,LocalBusiness,,,,,San Dimas Center,,,https://www.foodpantries.org/gallery/no_photo_8.jpg,"Our Food Security Program helps some 4,000 no and low income residents of the Inland Valley access high-quality, healthy food resources each month with 5 program centers located in Pomona, Ontario, San Dimas, Claremont and South Pomona plus 2 once/month food distributions in Upland and Chino.What We DoAt our sites,clients are provided with a 4-5 day supply of food every 30 days (homeless every two weeks). Families may also receive fresh produce through our partnership with Amy's Farm (a working farm that donates a sizeable",(909) 599-1103,,,,,,,,,San Dimas,110 E. Third Street,CA,91773,PostalAddress
https://schema.org,LocalBusiness,,,,,Shepherd's Pantry Glendora,,,https://www.foodpantries.org/gallery/no_photo_6.jpg,"We are open to the public  for food and clothing service.Hours:Wednesday and Thursday5:00pm - 7:00pm You must have a residence address in  one of the ten (10) cities we serve: Azusa, Baldwin Park, Claremont,  Covina, Glendora, Hacienda Heights, La Puente, La Verne, San Dimas &  West Covina. Please bring proof of residence address on your first  visit, such as a driver's license or utility bill. There is no charge  for our services and you may return once per month for up to six months:  extended programs are...",(626) 852-7630,,,,,,,,,Glendora,657 E. Arrow Highway,CA,91740,PostalAddress
https://schema.org,LocalBusiness,,,,,Shepherd's Pantry,,,https://www.foodpantries.org/gallery/no_photo_5.jpg,"The people who utilize our services come from all walks of life. We all experience difficult times in our lives and sometimes we need a helping hand. More than 50% of the people we serve are experiencing a very temporary situation and just need a little help to get them through a rough time. Our volunteers genuinely love helping people and go out of their way to try to meet the needs of everyone we serve. The most rewarding part is the smiles and expressions of gratitude from those we serve.Hours:Wednesday, Thursday5:00pm - ...",(626) 852-7630,,,,,,,,,Glendora,657 E. Arrow Highway,CA,91740,PostalAddress
https://schema.org,LocalBusiness,,,,, Inland Valley Hope Partners - Sova Program Center,,,https://www.foodpantries.org/gallery/no_photo_8.jpg,"Our Food Security Program helps some 4,000 no and low income residents of the Inland Valley access high-quality, healthy food resources each month with 5 program centers located in Pomona, Ontario, San Dimas, Claremont and South Pomona plus 2 once/month food distributions in Upland and Chino.What We DoAt our sites,clients are provided with a 4-5 day supply of food every 30 days (homeless every two weeks). Families may also receive fresh produce through our partnership with Amy's Farm (a working farm that donates a sizeable...",(909) 622-3806,,,,,,,,,Pomona,1753 N Park Ave,CA,91761,PostalAddress
https://schema.org,LocalBusiness,,,,,Inland Valley Hope Partners,,,https://www.foodpantries.org/gallery/no_photo_2.jpg,"Hours:Monday - Thurday9:00am - 3:00pmEmergency Food Assistance; location in Ontario, Pomona, Claremont and San DimasEmergency Housing Program. For more information, please call. ...",(909) 622-3806,,,,,,,,,Pomona,1753 N. Park Ave.,CA,91768,PostalAddress
https://schema.org,LocalBusiness,,,,,New Life Community,,,https://www.foodpantries.org/gallery/no_photo_5.jpg,"Hours:Friday4:00pmFor more information, please call. ...",(909) 593-7070,,,,,,,,,Pomona,275 E Foothill Blvd,CA,,PostalAddress
https://schema.org,LocalBusiness,,,,,Lighthouse Foursquare,,,https://www.foodpantries.org/gallery/no_photo_3.jpg,Free Food Distribution HoursSATURDAY 8:30am to 10:30am  No information will not be asked! Come and get your free grocery bag!,(818) 403-6432,,,,,,,,,San Fernando,622 N Maclay Ave.,CA,91340,PostalAddress
https://schema.org,LocalBusiness,,,,,City Team Ministries,,,https://www.foodpantries.org/gallery/107_city-team-ministries_ipf.jpg,"ityteam is founded on meeting local needs. Our programs in San Jose, Philadelphia, San Francisco, Oakland, and Portland offer help and hope to those in need with hot meals, shelter, recovery programs or addiction treatment centers, clothing, hygiene items, and so much more.For more information, please call.",415-861-8688,,,,,,,,,San Francisco,164 6th Street,CA,95112,PostalAddress
https://schema.org,LocalBusiness,,,,,Raphael House of San Francisco: Shelter for Homeless Families,,,https://www.foodpantries.org/gallery/no_photo_3.jpg,"For  thirty seven years, Raphael House has been a leader in family  services in San  Francisco. Through a homeowners   approach to social  service, we work with  parents and families to lay the foundations for a  lifetime of healthy  development, achievement and stability. Long after  a family departs to stable  housing, our staff, volunteers and Board of  Directors remain committed to  the lifetime success of each of our  families through a spectrum of AfterCare  services. Our residential  shelter program has a proven history of provi",415.345.7200,,,,,,,,,San Francisco,1065 Sutter St.,CA,94109,PostalAddress
https://schema.org,LocalBusiness,,,,,Food Runners,,,https://www.foodpantries.org/gallery/298_food-runners_hwl.png,"The mission of Food Runners is to help alleviate hunger in San Francisco, to help prevent waste and to help create community.For more information, please call.",415-929-1866,,,,,,,,,San Francisco,2579 Washington Street,CA,94115,PostalAddress
https://schema.org,LocalBusiness,,,,,Glide Memorial United Methodist Church: Soup Kitchen & More,,,https://www.foodpantries.org/gallery/670_glide-memorial-united-methodist-church-soup-kitchen-more_tqd.png,"Our DAILY FREE MEALS PROGRAM fills your body and soul with a nourishing meal in an atmosphere of respect, acceptance and love.Hours:Monday - FridayBreakfast 8:00am - 9:00 amLunch 12:00 pm - 1:30 pmDinner4:00 pm - 5:30 pm Saturday &amp; SundayBagged lunches served 12:00 pm - 1:30 pm ",,,,,,,,,,San Francisco,330 Ellis Street,CA,94102,PostalAddress
https://schema.org,LocalBusiness,,,,,San Francisco Food Bank,,,https://www.foodpantries.org/gallery/708_san-francisco-food-bank_xvh.png,"The SF-Marin Food Bank is the critical link between food and people. We provide food to over 450 community partners and will distribute 47 million pounds of food to 225,000 people in need - enough for 100,000 meals a day.For more information, please call.",(415) 282-1900,,,,,,,,,San Francisco,900 Pennsylvania Ave,CA,94107,PostalAddress
https://schema.org,LocalBusiness,,,,,CUSA,,,https://www.foodpantries.org/gallery/no_photo_8.jpg,"CUESA’s programs inspire healthy eating, connect eaters with farmers, and nurture an alternative to our industrial food system.For more information, please call.",415-291-3276,,,,,,,,,San Francisco,1 Ferry Building,CA,94111,PostalAddress
https://schema.org,LocalBusiness,,,,,St. Gregory of Nyssa - Food Pantry,,,https://www.foodpantries.org/gallery/3813_the_food_pantry_ formerly_st_gregorys_food_pantry_eou.jpg,"Hours:Friday12:00pm - 3:00pmFor additional information, please call.",(415) 255-8100,,,,,,,,,San Francisco,500 DeHaro St,CA,94110,PostalAddress
https://schema.org,LocalBusiness,,,,,Bethel A M E Church,,,https://www.foodpantries.org/gallery/34355_bethel-a-m-e-church_hcs.jpg,"The Bethel Food Pantry provides groceries, meat, fruit, and produce to needy households each Friday, helping families to meet their nutritional needs with quality food products, shared without qualification of income or residency. Over 300 households are served each week.Pantry Enrollment Form  given Fridays must Enrollment  Cards are sent via US mail via San Francisco Food Bank  Shopping HoursFriday11:30am - 1:30pm BY COLOR CODE TIMES ONLY On given hours April / May / June Card Col",415-921-4935,,,,,,,,,San Francisco,916 Laguna  Street,CA,94115,PostalAddress
https://schema.org,LocalBusiness,,,,,Youth With A Mission,,,https://www.foodpantries.org/gallery/24332_youth_with_a_mission_94102_fpg.jpg,"The Food Pantry Hours:Thursday, 1:30pm to 3:00pmThe line starts forming at 11:00 AM. The food pantry is closed on all major holidays. Must be a resident of zip code 94102. Requires ID. Provides food assistance to residents of the Tenderloin.",415-885-6543,,,,,,,,,San Francisco,357 Ellis Street,CA,94102,PostalAddress
https://schema.org,LocalBusiness,,,,,West Bay Conference Center,,,https://www.foodpantries.org/gallery/no_photo_9.jpg,"Provides a food pantry.  Serves San Francisco County (94115, 94117) Pantry Hours: Thursday 12:30pm",(415) 749-6470,,,,,,,,,San Francisco,1290 Fillmore Street,CA,94115,PostalAddress
https://schema.org,LocalBusiness,,,,,Temple United Methodist Church,,,https://www.foodpantries.org/gallery/24289_temple_united_methodist_church_94132_abr.jpg,"Provides a food pantry.  Serves San Francisco County Pantry Hours: Wednesday 4:00pm - 6:40pmWe are always seeking volunteers and need help from 2:00 pm when our truck arrives, right through till 7:00 when we finish distributing the food.",(415) 586-1444,,,,,,,,,San Francisco,65 Beverly Street,CA,94132,PostalAddress
https://schema.org,LocalBusiness,,,,,St Francis Episcopal Church Food Pantry,,,https://www.foodpantries.org/gallery/no_photo_5.jpg,"Provides a food pantry.  Serves: San Francisco County (94112, 94127, 94132) Documentation Required: Photo ID Pantry Hours: Wednesday 3:45pm (Closed on all major holidays)For more information, please call. ",(415) 334-1590,,,,,,,,,San Francisco,399 San Fernando Way,CA,94127,PostalAddress
https://schema.org,LocalBusiness,,,,,St John's Presbyterian Church,,,https://www.foodpantries.org/gallery/no_photo_1.jpg,"Provides a food pantry.  Serves San Francisco County (94118, 94121) Pantry Hours: Saturday 8:00amFor more information, please call.",(415) 751-1626,,,,,,,,,San Francisco,25 Lake Street,CA,94118,PostalAddress
https://schema.org,LocalBusiness,,,,,St Andrew Missionary Baptist Church,,,https://www.foodpantries.org/gallery/24234_st_andrew_missionary_baptist_church__gwu.jpg,"Provides a food pantry.  No ID required, just a smile. Pantry Hours: Those without appointments, get food onWednesday 9:00am",415-346-6500,,,,,,,,,San Francisco,2565 Post Street,CA,94143,PostalAddress
https://schema.org,LocalBusiness,,,,,St Anthony de Padua Church,,,https://www.foodpantries.org/gallery/24236_st_anthony_de_padua_church_94110_rtg.jpg,"Provides a food pantry.  Serves San Francisco (94110, 94112) Pantry Hours: Friday 11:00am",(415) 647-2704,,,,,,,,,San Francisco,3215 Cesar Chavez Street,CA,94110,PostalAddress
https://schema.org,LocalBusiness,,,,,St Anthony's Emergency Food Pantry,,,https://www.foodpantries.org/gallery/24237_st_anthonys_emergency_food_pantry__vvj.png,"The Dining Room has served poor and homeless Tenderloin residents since 1950. Requirements:ID and proof of housing required. Hours:10:00am-11:45am - Open to Families with Children and Seniors age (60+)11:30am-1:30pm - (Open to AnyoneFor more information, please call.",(415) 241-2690,,,,,,,,,San Francisco,150 Golden Gate Avenue,CA,94102,PostalAddress
https://schema.org,LocalBusiness,,,,,Salvation Army Asian American Yerba Buena,,,https://www.foodpantries.org/gallery/no_photo_5.jpg,"Provides a food pantry.  For seniors 60+ who live in 94103, 94105, or 94107 zip code. ID required. Care providers must have client's ID with current address, their own ID, and authorization letter. Pantry Hours: Call for interview Monday - Thursday 10:00am - 2:00pm Food given out Friday 9:00am - 10:30am",415-777-2677,,,,,,,,,San Francisco,360 4th Street,CA,,PostalAddress
https://schema.org,LocalBusiness,,,,,"Salvation Army Family Services, Chinatown Court",,,https://www.foodpantries.org/gallery/no_photo_3.jpg,"Provides a food pantry.  Must live in 94104, 94108, 94109, 94111, 94123, 94129, 94130, 94133, or 94158. ID required. Pantry Hours: Call for interview Monday - Thursday 10:00am - 2:00pm. Food given out Friday 9:00am - 10:30am.",415-781-7360,,,,,,,,,San Francisco,1450 Powell Street,CA,94133,PostalAddress
https://schema.org,LocalBusiness,,,,,"Salvation Army Family Services, Mission",,,https://www.foodpantries.org/gallery/24197_salvation_army_family_services_mission__mea.png,"Provides a food pantry.  Must live in 94107, 94110, 94112, 94114, or 94131 zip code. Bring ID, proof of income and of address. Pantry Hours: Call for interview Monday - Thursday 10:00am - 2:00pm. Food given out Friday 9:00am - 10:30am",415-648-0260,,,,,,,,,San Francisco,1156 Valencia Street,CA,94110,PostalAddress
https://schema.org,LocalBusiness,,,,,Portola Baptist Church,,,https://www.foodpantries.org/gallery/no_photo_5.jpg,Provides a food pantry.  Serves San Francisco Count (94112 and 94134).,(415) 584-3230,,,,,,,,,San Francisco,225 Pioche Street,CA,94134,PostalAddress
https://schema.org,LocalBusiness,,,,,Potrero Hill Family Resource Center,,,https://www.foodpantries.org/gallery/no_photo_9.jpg,Provides a food pantry.  Serves San Francisco County (94107) Pantry Hours: Friday: 12:30pm (Closed on all major holidays),(415) 206-2121,,,,,,,,,San Francisco,85 Turner Terrace,CA,94107,PostalAddress
https://schema.org,LocalBusiness,,,,,Project Open Hand,,,https://www.foodpantries.org/gallery/24176_project_open_hand__owa.png,"Provides a food pantry.  Pantry Hours: Call Monday -Saturday 9:00am - 4:00pmFor interview appointment.If accepted, Pick-up Food Hours:Tuesday 9:00am - 4:00pm Wednesday - Saturday 11:00am - 4:00pm",415-447-2300,,,,,,,,,San Francisco,730 Polk Street,CA,94109,PostalAddress
https://schema.org,LocalBusiness,,,,,Richmond District Neighborhood Center,,,https://www.foodpantries.org/gallery/24180_richmond_district_neighborhood_center_94121_mvl.jpg,Provides a food pantry.  Serves San Francisco (94121) Pantry Hours: Thursday 3:00pm (Closed on all major holidays),(415) 751-6600,,,,,,,,,San Francisco,741  30th Avenue,CA,94121,PostalAddress
https://schema.org,LocalBusiness,,,,,San Francisco City Impact,,,https://www.foodpantries.org/gallery/24186_san_francisco_rescue_mission_94102_idt.jpg,A program of San Francisco City Impact. Sign up Hours:Wednesday12:00pm and 12:30pmFood Distribution Hours:Thursday12:00pm to 12:30pm Must be a resident of zip code 94102. Requires photo ID and proof of address. Clients may receive food once per month.,(415) 292-1770,,,,,,,,,San Francisco,230 Jones St,CA,94102,PostalAddress
https://schema.org,LocalBusiness,,,,,Our Lady of Lourdes Parish,,,https://www.foodpantries.org/gallery/no_photo_3.jpg,Provides a food pantry.  Serves San Francisco County Pantry Hours: Saturday 10:00am(Closed on all major holidays),(415) 285-3377,,,,,,,,,San Francisco,1715 Oakdale Avenue,CA,94124,PostalAddress
https://schema.org,LocalBusiness,,,,,Mission Presbyterian Church,,,https://www.foodpantries.org/gallery/no_photo_1.jpg,Provides a food pantry.  Serves San Francisco County Pantry Hours: Sunday1:00pm (Closed on all major holidays),(415) 821-7551,,,,,,,,,San Francisco,3261 23rd Street,CA,94110,PostalAddress
https://schema.org,LocalBusiness,,,,,New Life Chinese Lutheran Church,,,https://www.foodpantries.org/gallery/24150_new_life_chinese_lutheran_church_94131_irt.jpg,Provides a food pantry.  Serves San Francisco County Pantry Hours: Saturday 9:00am (Closed on all major holidays),(415) 586-6525,,,,,,,,,San Francisco,395 Addison Street,CA,94131,PostalAddress
https://schema.org,LocalBusiness,,,,,Ingleside Community Center,,,https://www.foodpantries.org/gallery/no_photo_5.jpg,"Provides a food pantry.  Serves San Francisco County (94112, 94132) Pantry Hours: Thursday 10:30am(Closed on all major holidays)",(415) 586-4765,,,,,,,,,San Francisco,1345 Ocean Avenue,CA,94112,PostalAddress
https://schema.org,LocalBusiness,,,,,Iglesia Bautista Balboa Eben-ezer,,,https://www.foodpantries.org/gallery/no_photo_2.jpg,"Provides a food pantry.  Serves San Francisco County (Primarily the Excelsior District).For more information, please call.",(415) 585-6628,,,,,,,,,San Francisco,39 Amazon Avenue,CA,94112,PostalAddress
https://schema.org,LocalBusiness,,,,,Health Care of Homeless Vets,,,https://www.foodpantries.org/gallery/24098_health_care_of_homeless_vets_94107_duu.jpg,Provides a food pantry.  Serves San Francisco County (94107)Hours of Operation:Monday - Friday8:00am - 4:30pm,(415) 551-7300,,,,,,,,,San Francisco,401 3rd Street,CA,94107,PostalAddress
https://schema.org,LocalBusiness,,,,,Hunters Point Food Pantry - GIRLS 2000,,,https://www.foodpantries.org/gallery/24090_girls_2000_(hunters_point_food_pantry)__uei.png,"Hours: Thursday2:00pm to 3:30pmRequirements:ID is not required. Serves: families of Hunters Point. For more information, please call.",(415) 824-3225,,,,,,,,,San Francisco,718 Kirkwood Avenue,CA,94124,PostalAddress
https://schema.org,LocalBusiness,,,,,First United Presbyterian Church,,,https://www.foodpantries.org/gallery/no_photo_1.jpg,"Provides a food pantry.  Serves San Francisco County Pantry Hours: Saturday 10:30am - 11:00am For more information, please call.",(415) 759-3700,,,,,,,,,San Francisco,1740 Sloat Boulevard,CA,94132,PostalAddress
https://schema.org,LocalBusiness,,,,,Free The Need,,,https://www.foodpantries.org/gallery/no_photo_7.jpg,"Provides a food pantry.  Serves San Francisco County (Bernal Heights Neighborhood) Pantry Hours: Friday11:00am and 1:30pm Distribution date and time may vary during the Summer season, call for detail",(415) 587-6685,,,,,,,,,San Francisco,21st Street and Shotwell Street,CA,94110,PostalAddress
https://schema.org,LocalBusiness,,,,,Free The Need,,,https://www.foodpantries.org/gallery/no_photo_6.jpg,"Provides a food pantry.  Serves San Francisco County (Bernal Heights Neighborhood) Pantry Hours: Friday 11:00am - 1:30pm Distribution date and time may vary during the Summer season, call for detail",415-587-6685,,,,,,,,,San Francisco,827 Joost Avenue,CA,94127,PostalAddress
https://schema.org,LocalBusiness,,,,,Dr. Charles Drew College Preparatory Academy,,,https://www.foodpantries.org/gallery/no_photo_6.jpg,Provides a food pantry.  Serves San Francisco County Pantry Hours: Wednesday 2:30pm (Closed on all major holidays),(415) 330-1526,,,,,,,,,San Francisco,50 Pomona Ave,CA,94124,PostalAddress
https://schema.org,LocalBusiness,,,,,Evergreen Baptist Church,,,https://www.foodpantries.org/gallery/24057_evergreen_baptist_church_94124_nbs.jpg,Provides a food pantry.  Serves San Francisco County (94124) Pantry Hours: Saturday11:00am (Closed on all major holidays),(415) 467-1606,,,,,,,,,San Francisco,6270 3rd Street,CA,94124,PostalAddress
https://schema.org,LocalBusiness,,,,,Booker T. Washington Community Svce Center.,,,https://www.foodpantries.org/gallery/23986_booker_t._washington_community_svce_center.__ozc.jpg,"Provides a food pantry.  Produce, canned and dry goods. Requirements:Photo ID&nbsp; Pantry Hours: Call Wednesday for appointment 9:00am- 12:00pmPick up FoodThursday 11:30am - 1:00pm.",415 928-6596,,,,,,,,,San Francisco,800 Presidio Ave,CA,94115,PostalAddress
https://schema.org,LocalBusiness,,,,,Bayview TLC Family Resource Center,,,https://www.foodpantries.org/gallery/no_photo_10.jpg,The Food Pantry Hours:Monday - Thursday9:00 - 5:00pmFriday9:00am - 3:00pmMust be a resident of zip code 94124. Requires ID. Please bring a bag to carry home food.,(415) 822-9404,,,,,,,,,San Francisco,1601 Lane St Suite 205,CA,94124,PostalAddress
https://schema.org,LocalBusiness,,,,,St Paul Tabernacle Baptist,,,https://www.foodpantries.org/gallery/no_photo_5.jpg,Provides a food pantry.  Must live in 94124 zip code. ID required. Pantry Hours Friday 12:00pm - 2:00pm,(415) 642-4965,,,,,,,,,San Francisco,1789 Oakdale Ave,CA,94124,PostalAddress
https://schema.org,LocalBusiness,,,,,Mary Elizabeth Inn,,,https://www.foodpantries.org/gallery/24139_mary_elizabeth_inn.__jjr.jpg,"Provides a food pantry.  Women only, bring your own bag. Pantry Hours:  WednesdayLine up 9:30am",(415) 673-6768,,,,,,,,,San Francisco,1040 Bush St,CA,94109,PostalAddress
https://schema.org,LocalBusiness,,,,,Covenant Presbyterian Church,,,https://www.foodpantries.org/gallery/24047_covenant_presbyterian_church_94116_eoc.jpg,"Provides a food pantry.  Serves San Francisco County (94116, 94122, 94127, 94132) Pantry Hours:Saturday 9:00am - 10:00am",(415) 664-5335,,,,,,,,,San Francisco,321 Taraval Street,CA,94116,PostalAddress
https://schema.org,LocalBusiness,,,,,Bread Basket Food Bank,,,https://www.foodpantries.org/gallery/36399_bread-basket-food-bank_zqn.jpeg,"The Food Bank is operated through donations and is available to anyone to shop. There are no applications or qualifications needed. There is a variety of breads and different foods available each week. The suggested donations allow us to help others.  Emergency food box is available four times per year.Requirements: Please bring a photo ID and proof of residency for Hemet, San Jacinto, or surrounding rural areas for emergency food only.   Hours: Monday 8:00am - 11:00am Friday 8:00am - 11:00am",(951) 658-5098,,,,,,,,,San Jacinto,2385 S. San Jacinto Ave,CA,92583,PostalAddress
https://schema.org,LocalBusiness,,,,,Portugese Organization for Social Services and Opportunities,,,https://www.foodpantries.org/gallery/201_portugese-organization-for-social-services-and-opportunities_eje.jpg,"Federal surplus food commodities are also distributed to those low-income seniors who apply and qualify for this benefit.Business Hours:Monday - Thursday9:00am - 3:30pmFriday10:00am - 2:00pmFor more information, please call. ",(408) 293-0877,,,,,,,,,San Jose,1115 E. Santa Clara St.,CA,95116,PostalAddress
https://schema.org,LocalBusiness,,,,,Food Connection,,,https://www.foodpantries.org/gallery/no_photo_9.jpg,"For more information, please call.",(408) 266-8866,,,,,,,,,San Jose,750 Curtner Ave.,CA,95125,PostalAddress
https://schema.org,LocalBusiness,,,,,Martha's Kitchen,,,https://www.foodpantries.org/gallery/455_marthas-kitchen_dbk.png,"To feed the hungry with dignity; no questions asked.Meal Service Hours:Tuesday and Wednesday4:00pm - 5:00pmFor more information, please call. ",(408) 293-6111,,,,,,,,,San Jose,311 Willow Street,CA,95110,PostalAddress
https://schema.org,LocalBusiness,,,,,First Christian Church - Recovery Cafe,,,https://www.foodpantries.org/gallery/522_first-christian-church_mdi.svg,"Hours:Tuesday and Wednesday12:30pm - 6:00pmThursday and Friday12:30pm - 4:30pmFor more information, please call. ",(408) 294-2963,,,,,,,,,San Jose,80 South 5th Street,CA,95112,PostalAddress
https://schema.org,LocalBusiness,,,,,African American Community Center,,,https://www.foodpantries.org/gallery/532_african-american-community-center_irq.png,"For nearly 30 years, the African American Community Service Agency has served our community and provided programs and services that touch the lives of roughly 200,000 people every year. Starting with our youngest members and reaching out to seniors, there are activities, programs and special events as diverse as the people we serve. For more information, please call.",(408) 292-3157,,,,,,,,,San Jose,304 N. 6th St.,CA,95112,PostalAddress
https://schema.org,LocalBusiness,,,,,Loaves & Fishes,,,https://www.foodpantries.org/gallery/749_loaves-fishes-family-kitchen_uyi.jpg,"In partnership with Second Harvest Bank and volunteers from across the Bay Area, Loaves & Fishes also provides grocery bags to about 165 families each month. The bags are filled with nutritionally balanced items such as rice, beans, peanut butter, tuna fish, eggs, milk and fresh fruits and vegetables.Hours:Monday - Friday4:30pm - 5:30pmFor more information, please call.",(408) 998-5774,,,,,,,,,San Jose,1080 North 7th Street,CA,95112,PostalAddress
https://schema.org,LocalBusiness,,,,,Salvation Army,,,https://www.foodpantries.org/gallery/857_salvation-army_tmt.jpg,"The Emmanuel House provides services to the homeless community of San Jose, and has been doing so since 1967.Free hot meals served daily. For more information, please call. ",(408) 282-1175,,,,,,,,,San Jose,405 N. 4th St.,CA,95112,PostalAddress
